{
  "artifact_id": "acceptance_lock_artifact",
  "artifact_status": "validated",
  "schema_version": "1.0.0",
  "run_id": "RUN_demo_0001",
  "pass_id": "PASS_18",
  "timestamp": "2026-01-15T09:30:00Z",
  "produced_by_role": "acceptance_precheck_role",
  "produced_by_actor": "user",
  "ledger_ref": "68b880d6f1d10775761c573908a0df0a8787a483a828841c7bb3979aaa702959",
  "telemetry_refs": [
    "evt_0001"
  ],
  "claims_final_authority": false,
  "body": {
    "user_approval_recorded": true,
    "authorization_record_ref": "docs/KEY_FINAL_ASSEMBLY_AUTHORIZATION_RECORD.md",
    "readiness_checks": {
      "all_tests_pass": true,
      "protected_source_unmodified": true,
      "ledger_append_only": true,
      "user_remains_final_authority": true
    },
    "evidence_sufficiency_matrix": {
      "evidence_completeness": "certain",
      "telemetry_integrity": "probable"
    },
    "self_authorized": false
  },
  "evidence_source": "attestation",
  "route_id": "user_acceptance_escalation",
  "required_gate": "acceptance_lock_gate"
}
