{
  "artifact_id": "audit_report_artifact",
  "artifact_status": "validated",
  "schema_version": "1.0.0",
  "run_id": "RUN_demo_0001",
  "pass_id": "PASS_18",
  "timestamp": "2026-01-15T09:30:00Z",
  "produced_by_role": "refusal_escalation_role",
  "produced_by_actor": "Grok",
  "ledger_ref": "68b880d6f1d10775761c573908a0df0a8787a483a828841c7bb3979aaa702959",
  "telemetry_refs": [
    "evt_0001"
  ],
  "claims_final_authority": false,
  "body": {
    "action": "refusal",
    "reason": "Task frame requested unrestricted shell execution, a forbidden task type.",
    "failure_id": "unbounded_actor_authority",
    "severity": "critical",
    "escalated_to": "user",
    "resolved_by_ai_actor": false
  },
  "evidence_source": "attestation",
  "route_id": "protocol_audit_route",
  "required_gate": "actor_authority_gate"
}
