{
  "artifact_id": "lot_route_artifact",
  "artifact_status": "validated",
  "schema_version": "1.0.0",
  "run_id": "RUN_demo_0001",
  "pass_id": "PASS_18",
  "timestamp": "2026-01-15T09:30:00Z",
  "produced_by_role": "route_resolution_role",
  "produced_by_actor": "Codex",
  "ledger_ref": "68b880d6f1d10775761c573908a0df0a8787a483a828841c7bb3979aaa702959",
  "telemetry_refs": [
    "evt_0001"
  ],
  "claims_final_authority": false,
  "body": {
    "selected_route_id": "protocol_build_route",
    "eligible_route_ids": [
      "protocol_build_route",
      "protocol_validation_route",
      "protocol_repair_route",
      "protocol_audit_route"
    ],
    "selection_basis": "Task frame declares a protocol build task; build route is eligible and its gates are satisfiable.",
    "fallback_route_id": "protocol_repair_route"
  },
  "evidence_source": "program",
  "produced_by_program": {
    "name": "sk_emit.route",
    "sha256": "3974760c2cdc280c2e0174cbb49c7738ed3651eaf4e13529383b983c3b67fea5"
  },
  "route_id": "protocol_build_route",
  "required_gate": "lot_route_gate"
}
