{
  "artifact_id": "gate_decision_artifact",
  "artifact_status": "validated",
  "schema_version": "1.0.0",
  "run_id": "RUN_build_0001",
  "pass_id": "PASS_18",
  "timestamp": "2026-02-03T14:20:00Z",
  "produced_by_role": "gate_evaluation_role",
  "produced_by_actor": "Codex",
  "route_id": "protocol_build_route",
  "required_gate": "artifact_requirement_gate",
  "ledger_ref": "68b880d6f1d10775761c573908a0df0a8787a483a828841c7bb3979aaa702959",
  "telemetry_refs": [
    "evt_0001"
  ],
  "claims_final_authority": false,
  "body": {
    "gate_id": "ledger_requirement_gate",
    "decision": "pass",
    "enforcement_class": "automatic",
    "evidence_refs": [
      {
        "artifact_id": "ledger_entry_artifact",
        "sha256": "77dd26de5966cd08bd7412daa86440d098864de0922a83bd321572808aa0a89e"
      }
    ],
    "failure_id": null
  },
  "evidence_source": "program",
  "produced_by_program": {
    "name": "sk_emit.gate",
    "sha256": "26e1e6dab9d15e2d72308a03b91f443f2c1d9af5aa592ee73cb08b09134d4da2"
  }
}
