{
  "artifact_id": "schema_artifact",
  "artifact_status": "validated",
  "schema_version": "1.0.0",
  "run_id": "RUN_demo_0001",
  "pass_id": "PASS_18",
  "timestamp": "2026-01-15T09:30:00Z",
  "produced_by_role": "artifact_validation_role",
  "produced_by_actor": "Codex",
  "ledger_ref": "68b880d6f1d10775761c573908a0df0a8787a483a828841c7bb3979aaa702959",
  "telemetry_refs": [
    "evt_0001"
  ],
  "claims_final_authority": false,
  "body": {
    "schema_id": "solomons-key.logic-engine.v1.schema.gates",
    "schema_sha256": "6e5c080cd456d6cd40e631b502c9b1810e80e57c3bd58ce9191828c2fc6fffe8",
    "instance_sha256": "7d730e9263cf723554de19c7d2bc9885bd04558f7cfc6fca715b191a709d1cf3",
    "result": "pass",
    "errors": []
  },
  "evidence_source": "program",
  "produced_by_program": {
    "name": "sk_artifacts.validate",
    "sha256": "fa2d03ac9095451e61e856d566f288351ee90e9ebd30265bb5481b8ab15170d5"
  },
  "route_id": "protocol_validation_route",
  "required_gate": "schema_validation_gate"
}
