{
  "artifact_id": "source_inventory_artifact",
  "artifact_status": "validated",
  "schema_version": "1.0.0",
  "run_id": "RUN_demo_0001",
  "pass_id": "PASS_18",
  "timestamp": "2026-01-15T09:30:00Z",
  "produced_by_role": "task_intake_validator_role",
  "produced_by_actor": "Codex",
  "ledger_ref": "68b880d6f1d10775761c573908a0df0a8787a483a828841c7bb3979aaa702959",
  "telemetry_refs": [
    "evt_0001"
  ],
  "claims_final_authority": false,
  "body": {
    "source_root": "D:\\Solomons_Forge_Source_Files_Unaltered",
    "files": [
      {
        "path": "00_Solomon_Forge_Core_Doctrine.txt",
        "sha256": "a6747a6bee7c5008ef8414f3644e48416907e177113be254659a95c9043f14e1",
        "bytes": 22715
      },
      {
        "path": "09_Gpt_Solomons_Forge_Master_Loader.txt",
        "sha256": "d47712cceb4c780603026e6325221c1bcff90679ebc076baa51c71ebe796717c",
        "bytes": 15545
      }
    ],
    "inventory_sha256": "b11a85b296a90afc460430434a504e7acb04b064575b7277724688af0e59d189"
  },
  "evidence_source": "program",
  "produced_by_program": {
    "name": "sk_emit.inventory",
    "sha256": "e5a554d2c5e60c38f82f7e7954d70144e9d1b9546c3cf742a0cde3784f26f3f7"
  },
  "route_id": "protocol_build_route",
  "required_gate": "source_boundary_gate"
}
