{
  "artifact_id": "validation_report_artifact",
  "artifact_status": "validated",
  "schema_version": "1.0.0",
  "run_id": "RUN_build_0001",
  "pass_id": "PASS_18",
  "timestamp": "2026-02-03T14:20:00Z",
  "produced_by_role": "artifact_validation_role",
  "produced_by_actor": "Codex",
  "route_id": "protocol_build_route",
  "required_gate": "artifact_requirement_gate",
  "ledger_ref": "68b880d6f1d10775761c573908a0df0a8787a483a828841c7bb3979aaa702959",
  "telemetry_refs": [
    "evt_0001"
  ],
  "claims_final_authority": false,
  "body": {
    "layers_run": [
      "syntax_validation",
      "schema_validation",
      "doctrine_validation",
      "task_frame_validation",
      "lot_routing_validation",
      "gate_validation",
      "artifact_validation",
      "telemetry_validation",
      "ledger_validation",
      "cross_section_consistency_validation"
    ],
    "layers_skipped": [
      "gate_validation",
      "ledger_validation"
    ],
    "result": "pass",
    "validator_sha256": "637643fc62259bf7cafac61a1650c8a22d2ed0572dd1494b164b6dad1f5c69d0",
    "findings": []
  },
  "evidence_source": "program",
  "produced_by_program": {
    "name": "sk_emit.validate",
    "sha256": "23c5ce9b2ac116369914b4c9c030563c6075b7971b55164eac2fb96d5d81ed05"
  }
}
