{
  "artifact_id": "final_key_artifact_reserved",
  "artifact_status": "reserved",
  "schema_version": "1.0.0",
  "run_id": "RUN_demo_0001",
  "pass_id": "PASS_18",
  "timestamp": "2026-01-15T09:30:00Z",
  "produced_by_role": "final_assembly_role_reserved",
  "produced_by_actor": "user",
  "ledger_ref": "68b880d6f1d10775761c573908a0df0a8787a483a828841c7bb3979aaa702959",
  "telemetry_refs": [
    "evt_0001"
  ],
  "claims_final_authority": false,
  "body": {
    "reserved": true,
    "reason": "Runtime final assembly is not implemented. Requires user authorization.",
    "requires_user_authorization": true
  },
  "evidence_source": "attestation",
  "required_gate": "final_assembly_gate"
}
