{
  "artifact_id": "gate_decision_artifact",
  "artifact_status": "validated",
  "schema_version": "1.0.0",
  "run_id": "RUN_demo_0001",
  "pass_id": "PASS_18",
  "timestamp": "2026-01-15T09:30:00Z",
  "produced_by_role": "gate_evaluation_role",
  "produced_by_actor": "Codex",
  "ledger_ref": "68b880d6f1d10775761c573908a0df0a8787a483a828841c7bb3979aaa702959",
  "telemetry_refs": [
    "evt_0001"
  ],
  "claims_final_authority": false,
  "body": {
    "gate_id": "schema_validation_gate",
    "decision": "pass",
    "enforcement_class": "automatic",
    "evidence_refs": [
      {
        "artifact_id": "schema_artifact",
        "sha256": "325c836ef9922e2650dd2cf451a27922e292a316c3edf317fa7c84c8439083d4"
      }
    ],
    "failure_id": null
  },
  "evidence_source": "program",
  "produced_by_program": {
    "name": "sk_emit.gate",
    "sha256": "26e1e6dab9d15e2d72308a03b91f443f2c1d9af5aa592ee73cb08b09134d4da2"
  },
  "route_id": "protocol_validation_route",
  "required_gate": "artifact_requirement_gate"
}
